Date,NumberOfSubjects,Fatal,SubjectArmed,SubjectRace,SubjectGender,SubjectAge,NatureOfStop,NumberOfShots,NumberOfOfficers,OfficerRace,OfficerGender,Department,FullNarrative,City,Notes
2/21/2016,1,F,Y,U,F,36,Call for Service,1,1,W,M,Phoenix Police Department,"Numerous CFS generated priority 1 CFS. Officers respond determine correct location via 21. Numerous attempts to make contact via 21.Officers set up on apt in front and back. Subj presents herself at back window. 2 officers in back attempt to de-escalate subject. Subj has handgun; points at herself, waves outside points in direction of officer. OIS officer discharges one round from rifle; Y shot. ",Phoenix,
2/23/2016,1,F,Y,W,M,26,Shooting,3,1,W,M,Phoenix Police Department,"Patrol responded to a CFS of shooting by OIS Subj. Upon arrival, found residence was on fire, incident becomes a multi-agency effort to contain fire and provide enforcement. OIS Subj shoots and kills four family members and is believed to be dead inside. While SAU is attempting to clear a room for victim extraction, OIS officer makes contact with OIS Subj. Subj points handgun at OIS officer. OIS officer fires three rounds with three hits; Y injuries. ",Phoenix,
2/24/2016,1,F,N,W,M,28,Stolen car,1,1,W,M,Phoenix Police Department,"487V Detectives conducting follow-up on a stolen vehicle (with GPS tracker on it). Patrol attempts a C6 vehicle flees; air unit takes up survaillance. Gang LT calls Tac Survaillance; TacSurv being organized. Subj vehicle exits freeway at 75th Ave. In traffic at stop light, and patrol officers approach vehicle. Offcs attempt to give commands; subj does not comply. OIS officer contacts Subj at driver door; breaking driver window. Subj puts vehicle in reverse and OIS offc is on vehicle. Subj kicks OIS offc. Subj begins driving fwd. OIS offc believes secondary offc in danger. Discharges one round at Subj; Y injuries. ",Phoenix,Vehicle
3/30/2016,1,N,Y,W,M,30,Kidnapping,50,3,W; W; H,M; M; M,Phoenix Police Department,"Patrol responds to a P1 CFS of a possible kidnapping. Officers circulating find the vehicle in area and attempt a traffic stop. Immediately upon initiating stop, OIS subj begins firing at officers.  OIS officer return fire; all misses. Prior to fleeing, subj kills his original kidnapping victim in the vehicle. Subj flees and takes hostages in a residence. SAU responds and negotiates with the subj; subj surrenders with no further injuries to hostages, subj, or officer. ",Phoenix,
5/14/2016,1,F,Y,U,M,43,Home invasion,16,1,H,M,Phoenix Police Department,"Officer and Sergeant responded to possible home invasion call. Suspect ambushed both officer and sergeant from behind an SUV as they approached the apartment, firing several rounds at both. Officer sustained gsw to upper arm, sgt sustained gsw to abdomen (stopped by bullet proof vest). Officers returned fire, suspect pronounced. Suspect had committed a homicide just prior to PD arrival.",Phoenix,
5/18/2016,1,F,Y,W,M,21,Burglary,65,6,W/H; W; W; W/H; W; W,M; M; M; M; M; M,Phoenix Police Department,"CI-CFS of a 459R with an armed and possibly violent subj. Units stage and develop plan to contain residence and determine the presence of the subject. While approaching the house, Officer 1 pulls behind the subj vehicle to box it in. Offc 1 immediately sees the subj in the vehicle; he and his partner exit the patrol vehicle to take a position of cover. The subj opens the door and fires 6 round, 2 striking Offc 1, one Y. 6 officers engage the subj discharging numerous rounds. Subj struck numerous times; Y injuries.",Phoenix,
5/19/2016,1,N,N,W,M,18,Call for Service,7,1,W/ H,M,Phoenix Police Department,"Subj generated a number of CI-CFSs throughout the day. Subj finally found and a pursuit was initiated. As the subj turned from Camelback road onto 51st Avenue, he pointed a handgun out the window at OIS officer. OIS officer discharges 7 rounds from within in his patrol vehicle at the subj. The pursuit continued and later ended and the subj was taken into custody. No injuries to subj or officers. ",Phoenix,BB Gun
5/26/2016,1,F,Y,NA,M,34,Homicide,1,1,W,M,Phoenix Police Department,"Subj committs a homicide and fled the scene. Subj located @ 3300 W. Southern Ave. Subj advised officers he still had the gun. Subj refused to obey commands & was tesered X4 & stunbag X2. He reached for his gun & Ofc shot him (1) time, Later Pronounced.",Phoenix,
6/1/2016,1,F,Y,W,M,30,Check welfare; fire,27,4,W/ H; W/H; W/A; W,M; M; M; M,Phoenix Police Department,"Officer responded to a check welfare radio call  to assist Fire.  Officer located the suspect standing behind a pillar with a handgun.  Officer took a position of cover and waited for back up to arrive.  While waiting, the suspect began firing at Officer. Three other officers arrived to an active gun fight. Officers took positions and engaged the suspect.  Suspect sustained multiple gun shots and was pronounced at the scene.  U reasons for his actions.  The criminal investigation listed alcohol in the investigation report. ",Phoenix,
6/4/2016,1,N,Y,W,M,16,Underaged party,1,1,W,M,Phoenix Police Department,"Officer and Sergeant were driving by a juvenile party advertised on facebook. Saw what appeared to be a fight then heard a shotgun blast, U who or where. A few seconds later saw subject with a shotgun. Subject pointed a gun at kids fleeing, then at above officer and sergeant, in the car. officer  fired (1) Round through passenger window glass as subject fired at them. Sgt. accelerated away to a position of safety. subject tracked them around corner with shotgun leveled and pointed at them. Juvenile subject was identified later and arrested 13 days after. no toxicology, and no information in clips for records. PSB investigator provided the following info - juvenile was in canyon state academy boot camp for U charges and escaped. found a returned to custody of state. New charges were filed as adult.",Phoenix,
6/16/2016,1,N,N,W,M,71,Firearm,2,1,W,M,Phoenix Police Department,"CI-CFS of a subj with a gun. Two officers arrive and contact subject. Subj keeps point what appears to be a handgun, later determined to be a toy gun, at officer. OIS officer discharges one round, striking the subject. Subj goes down with toy gun and he begins to point it at officers again. OIS officer discharges a second round, striking the toy gun, removing it from his hand. Subj injuries not Y.",Phoenix,Toy Gun
7/8/2016,1,N,Y,W,M,31,Robbery,1,1,W,M,Phoenix Police Department,"CI-CFS of a silent 211A at a Walgreens pharmacy. Officer arrives determines valid. Confronts subject outside front door near parking lot. Approaches subject gives commands and observes what he believes to be the handle of a firearm, later determined to be a ‘flare gun’. Physical fight ensues with the subj and officer. Officer is struck numerous times to the face and body, feels subject going for his gun, which is in his right hand. Officer discharges one round, striking subject in the leg. Back-up officers arrive and the subject is taken into custody. ",Phoenix,
8/7/2016,1,N,N,W,M,27,Assault,1,1,W,M,Phoenix Police Department,"Subj commits an assault on girlfriend and passerby on the street, retreats into his mother’s house.  Perimeter established.  A 5 person team, including 2 Sgts and a LT approaches the front door.  Perimeter officers see subj assault mother inside.  Front door is breached, subj and mom are standing on the stairs just inside.  Subj has a large knife and threatens mom.  Sgt gave commands to drop the knife and then fired 1 round, striking the subj.  Required minor surgery.",Phoenix,Knife/ Sword
8/13/2016,1,F,N,W,M,39,Investigation,2,1,W,M,Phoenix Police Department,"NET officers located IL vehicle on 43rd Av from a 451 on 75th Dr.  MOU/SAU officers get consent to enter condo from IL’s sister.  While clearing the structure, they find a locked bedroom.  When officers enter the room, IL charges Officer from his hiding place in the closet, slashing Officer on the left hand with a knife.  Officer fires 2 rounds, stopping the attack.  Subj was pronounced on scene.",Phoenix,Knife/ Sword
8/19/2016,1,F,N,W,M,22,Burglary,3,2,W; W,M; M,Phoenix Police Department,"Officer 1 was looking for a transient burglary suspect near the park.  He stopped to check a 647V.  Contacts unrelated subj from nearby bushes who behaves erratically.  During a pat down, the subj elbow strikes and then punches officer, breaking his nose.  Struggle ensues, and officer places subj at gunpoint.  Subj attempts to take officers weapon.  Officer 2 arrives and obtains a clear shot at the same time Officer 1 creates distance.  Officer 2 fires twice, Officer 1 fires once.  Subj was pronounced on scene. ",Phoenix,Reached for Officer's Gun
8/27/2016,1,F,N,W,M,25,Firearm,7,1,W,M,Phoenix Police Department,"Officer knocks on door of possible 417G apt. Lt  standing outside with clear view into apt when door opens.  Subj crosses doorway inside, pointing a BB gun at officers.  Lt fires once, subj retreats to bedroom.  Officers move to cover.  Subj appears again, points gun at officers.  Lt fires 6 more rounds, stopping subj.  Subj was pronounced on scene.",Phoenix,BB Gun
9/2/2016,1,N,N,W,M,23,Robbery,2,1,W/ H,M,Phoenix Police Department,"Officer  sees subj believed to match description of 211 subj from 2 days prior while driving to a call.  Turns around to make contact.  Subj approaches marked Tahoe, won’t keep hands out of pockets.  Asks if officer has gun or taser.  Subj pulls knife from pocket.  Officer fires 2 rounds, both strike subj.  Subj transported for medical and booked.",Phoenix,Knife/ Sword
9/6/2016,1,F,N,W,M,25,Call for Service,6,2,W/ H; A,M; M,Phoenix Police Department,"OIS Subject earlier in the day generated a P1 CI-CFS but fled and was not located. Subj returned to OIS location and mother generated CI-CFS saying subject returned. It was determined the subj had felony warrant-probation violation. Containment set-up by patrol and TSB personnel; numerous units on scene. SGT and LT on scene. Bunker and less-lethal make approach and knock & announce then move back to position of cover. Officer indicated subject moving inside and is coming to the door. Subj unexpectedly exited apartment. Officers 'fanned' out in a skirmish line, obstructing the K9 option. Subj advanced the line of officers with a knife, not obeying commands. Simultaneous to one another, two officers deployed stunbag, one round each with one strike; two officers fired 6 rounds in total at the subject, 4 strikes. Subj sustained Y injuries, pronounced at scene. ",Phoenix,Knife/ Sword
9/6/2016,1,F,Y,W,M,31,Robbery,11,3,W; W; W,M; M; M,Phoenix Police Department,"OIS Subject participated in an armed bank robbery in Avondale (AZ).  OIS Subj was the driver of the vehicle pursued. Numerous shots fired from vehicle at times during the pursuit. AvondalePD requested PPD assistance; PPD took over pursuit. PPD SAU officers in unmarked vehicles moved into position; vehicle interdiction options approved by SAU SGT. As subject approached a viable location, a PIT maneuver was executed blocking the OIS subj in his vehicle. As SAU officers exited their vehicles to make contact and attempt to apprehend, subj raised and point a handgun at officers. OIS officers discharged 11 rounds in total, 6 hits in total. Subj sustained Y injuries, pronounced at scene.  ",Phoenix,
9/15/2016,1,F,Y,W,M,32,Home invasion,3,1,W,M,Phoenix Police Department,"Officers respond to a home invasion CI-CFS. Contact is made with multiple subjs. OIS Subj flees in vehicle to residence at W Jones. Subj goes mobile again, pursuit continues. OIS Subj vehicle was 'spiked' when leaving W Jones. Subj loses control on I-17/I-10 exchange ramp. Subj exits vehicle, flees on foot; officers give chase. OIS Officer (SGT) sees subj with handgun. Subj turns at officers and raises handgun; OIS Officer fires three rounds, 1 hit. Y injury. ",Phoenix,
9/27/2016,1,F,Y,W,M,27,Traffic Stop,1,1,W,M,Phoenix Police Department,"Net team and uniformed officers conduct a traffic stop to investigate possible 237. As uniformed officers approach the vehicle, UC officer clearly sees OIS subject with handgun; UC officer makes his presence known. Subj begins ramming PD vehicle and UC officer fires one round. Y injury.",Phoenix,
10/11/2016,1,N,Y,W,M,27,Firearm,16,4,W; W; W; W,M; M; M; M,Phoenix Police Department,"CI-CFS for subj with a gun.  Officers locate subj who puts on body armor and has a handgun. Officers attempt to contain subj, who continues to walk through neighborhood, down alleys and over fences, ignoring verbal commands.  Subj pointed handgun at officers, who did not have a clear backdrop.  Subj made it to a 37th street between 2 marked cars and again pointed handgun at officers.  Officers 1 and 2 engaged subject, he then ran across 37th st and hid behind an electrical box.  Subj again pointed handgun at officers, and officers 1,2,3 fired.  Officer 3 hit subj with 1 round to the leg, requiring extensive surgery. ",Phoenix,
12/29/2016,1,N,N,W,M,30,Robbery,6,1,W,M,Phoenix Police Department,"907 to assist Peoria PD for 211 suspect.  Extended tactical surveillance by SAU, FAID and air unit. 211 suspect exits vehicle at Tatum/Mockingbird in Paradise Valley.  He uses a B pellet gun while attempting to carjack a vehicle stopped at the red light.  Sgt  (SAU) fired 6 rounds to stop carjacking.  Non-Y injuries, multiple surgeries required.",Phoenix,BB Gun
12/30/2016,1,F,N,W,M,31,Weapons posession,7,1,W,M,Phoenix Police Department,"CI-CFS for 211 by subject with a knife.  Officers locate subject on canal bank, who refuses to obey commands.  Subject is armed with 2 knives, grabs a blanket from his campsite and tries to split the officers L configuration.  Officer 1 attempts to tase subj twice with no effect.  Subj makes statements that they will need to shoot him because he is not going to stop.  Subj advances on Officer 1 who fires 7 rounds, stopping the threat.  Y injury.  OIS officer on specialty to patrol shift.",Phoenix,Knife/ Sword
