Date,NumberOfSubjects,Fatal,SubjectArmed,SubjectRace,SubjectGender,SubjectAge,NatureOfStop,NumberOfShots,NumberOfOfficers,OfficerRace,OfficerGender,Department,FullNarrative,City,Notes
4/23/2013,1,N,Y,W,M,37,Fraud,1,1,W,M,Phoenix Police Department,"Ofcrs responded to a theft by fraud call where subj trying to pass a bad check again.  Subj fled and ofcrs pursued on foot.  Subj tried to carjack two cars  and shot at occupants in both cars (one contained two children).  Ofcr shot at subj while he was trying to carjack second car with F and the two kids.  Ofc missed, subj drove off after victims got out of vehicle.  Subj taken into custody after tactical surveillance.  Alcohol was involved..",Phoenix,
4/26/2013,1,N,N,L,M,20,Traffic Stop; DUI,3,1,W,M,Phoenix Police Department,"Officers stopped DUI suspect who refused to exit his vehicle. He rammed the patrol car and then drove at an officer and another officer shot 3 times at the suspect, missed and struck the suspect vehicle. Officers were in a two-man unit and both attempted to gain compliance.",Phoenix,Vehicle
6/1/2013,1,F,Y,W,M,26,Suicide,6,3,W; H; H,M; M; M,Phoenix Police Department,Girlfriend called and said boyfriend left apartment with weapon because she was leaving him and he was theatening suicide. Ofc located him. He pointed the handgun at ofc and three ofcrs shot and killed the subj. ,Phoenix,
7/6/2013,1,N,N,W,M,36,Home invasion,5,1,W,M,Phoenix Police Department,"Ofc's responded to subject breaking into residence. Upon entering, subject came out from hall with weapon pointed at ofc's. Ofc discharged weapon as retreating.Airsoft AR-15 Carbine (toy gun)",Phoenix,Toy gun(air soft)
7/7/2013,1,N,Y,L,M,32,Domestic violence,4,1,H,M,Phoenix Police Department,"Officers responded to a domestic violence priority 1, upon arrival officers observed the suspect point a handgun at his fiancé. One officer fired 4 times, wounding the suspect.Substance (alcohol) may have been a factor based on witness statements.",Phoenix,
7/6/2013,1,F,N,W,M,35,Call for Service,2,1,W,M,Phoenix Police Department,"Ofc responded to poss domestic. Susp exited apt with two knives and came after ofc. Officer shot suspect two times in the head. Per subj father, subj was intoxicated. ",Phoenix,Knife/ Sword
7/11/2013,1,F,Y,L,M,32,Assault,14,2,W; W,M; M,Phoenix Police Department,"Officers resp to 245-1/ Contacted SP on bicycle. Subj pulled gun from waist, pointed at officers. Officers fired at subj, mortally wounding him.",Phoenix,
7/11/2013,1,N,N,W,M,20,Drugs,5,1,W,M,Phoenix Police Department,Traffic stop on suspects involved in drug transaction. Suspect fled in vehicle -U-turn in cul-de-sac heading directly at Ofc vehicle. Swerved missing it. Dif officer fired 5 rounds at car as it fled past him W/B believing the suspect rammed a PD vehicle.,Phoenix,Vehicle
7/13/2013,1,N,N,B,M,21,Armed robbery,1,1,W,M,Phoenix Police Department,Ofc's are advised of armed (knife) robbery. Ofc locates SP vehicle and follows. SP vehicle crashes. Ofc approaches SP veh and contacts SP in driver's seat. Ofc believes SP reaching for his (Ofc) gun and is touched on hand by SP. Discharges one round.No pursuit. ,Phoenix,Reached for Officer's Gun
8/5/2013,1,F,N,L,M,35,Domestic ,21,2,W; B,M; M,Phoenix Police Department,"Ofcrs responded to a 415F and attempted to talk to the suspect through a bathroom door. Suspect, without warning, opened the door and attacked the officers with a machete. Both ofcrs were cut. Both ofcrs fired and killed the suspect.",Phoenix,Knife/ Sword
8/21/2013,1,F,N,W,M,37,Investigation,11,2,H; W,M; M,Phoenix Police Department,"MOU attempted to contact violent felon. Subj rammed MOU vehicle. Detectives thought detective in danger of being crushed. Fired weapons at SP to protect detective, although detective had changed location. ",Phoenix,Vehicle
9/7/2013,1,F,Y,L,M,25,Shooting,3,1,H,M,Phoenix Police Department,Report of subject shooting gun in the air and pointing at vehicles. Responding ofc found subject who ran from officer. Subject turned and pointed weapon. Ofc shot subject.,Phoenix,
9/14/2013,1,F,Y,W,M,31,Suspicious person,22,3,W; W; W,M; F; M,Phoenix Police Department,"Ofcrs respond to a 647 (susp person) and encounter subj with a handgun sitting outside an apartment, who will not comply or drop the gun.  SAU responds.  Subj used heroin prior and drank beer  during the standoff.  Negotiations attempted for 2 hours approx and failed as subjects drugs wore off.  Subj became increasingly agitated.  SAU planned on using flashbang, SAGE, and canine to end standoff, however, flashbang engulfed subj in smoke and SAU could not see him.  Ofc 1 moved from cover to engage and was shot in the leg.  Ofc 1 also shot subj.  Ofcrs 2 and 3 also shot subj who died.  A fourth Ofc who was not an OIS officer was shot by subj in the vest, the vest stopped the bullet, ofc sustained bruises. ",Phoenix,
9/20/2013,1,N,N,W,M,31,Stolen car,31,5,H: H; H; W; W,M; M; M; M; M,Phoenix Police Department,"SP stole F550 - rammed numerous vehicles - hit PD motorcycle, rammed PD Tahoe head on. 5 ofcrs deployed firearms to stop the threat.",Phoenix,Vehicle
10/12/2013,1,N,N,L,M,22,Shooting,1,1,H,F,Phoenix Police Department,"Officer heard shot fired, subjects point out H/M in park. Officer observes him place U object under trash can. Makes contact, subject non-compliant then makes quick movement to waistband. Officer believes he is reaching for a gun and fires one round. Subject struck in leg and taken into custody. Force used by subject prior to OIS - Lethal Instrument: Subjects in park believe Subject fired round at them. Weapon was placed under trash can as subject walked away from officer (U to officer). Subject used no force and had no weapon during OIS but reached for waistband. Officer believed subject was going for a gun.",Phoenix,
11/3/2013,1,F,N,W,M,52,Suicide,4,1,W,M,Phoenix Police Department,Officers responded to M subject who threatened suicide. He charged at ofcrs with a knife. One ofc shot stopping the threat.Subject's girlfriend said the subject had been consuming alcohol prior to the incident.,Phoenix,Knife/ Sword
12/1/2013,1,N,Y,B,M,45,Domestic violence,5,3,W; W; W,M; M; M,Phoenix Police Department,"Patrol ofc does subject stop on SP of 245DV. SP shoots/misses at ofc. Foot pursuit / barricade of SP. SAU contains. SP points gun at SAU, who then fire at SP. Substance: Subject's wife said subject was drinking alcohol earlier in the day.",Phoenix,
12/6/2013,1,F,N,W,M,42,Assault,1,1,W,M,Phoenix Police Department,"Subj committed agg assault on neigh with hatchet, fled scene. Ofcs located subj and he threw a hatchet and knife at ofcs. Ofc deployed handgun 1x killing subj.",Phoenix,Knife/ Sword
12/28/2013,1,F,Y,B,M,41,Bank robbery,6,1,H,M,Phoenix Police Department,"Patrol ofc and Detective, driving separate responded to an U trouble at a bank, which was determined to be a valid robbery.  Subject emerged from the bank and shot at patrol officer 4 times, striking his patrol vehicle.  Detective observed the subjects actions and shot his handgun striking the subj in the neck and killing him.  No other injuries.  Subj was determined to have committed two additional bank robberies within the previous 5 days and during those crimes killed a police officer and seriously wounded another.",Phoenix,
2/13/2014,1,F,N,L,M,31,Traffic Stop,19,3,A; W; W,M; M; M,Phoenix Police Department,Officer conducted traffic stop. Subj advanced on officer with sword. Officers fired. ECD's attempted unsuccessfully. ,Phoenix,Knife/ Sword
3/3/2014,1,N,Y,W,M,43,Burglary ,6,1,W,M,Phoenix Police Department,"Subjs committing burglary of gun store. 1 subj fled busn on foot carrying handgun. Ofcs pursued. Subj turned to fire at ofcs (3x), Det returned fire (6x). Subj gave up and was placed under arrest. No injuries.",Phoenix,
3/3/2014,1,F,Y,W,M,29,Investigation,23,2,A/W; W,M; M,Phoenix Police Department,"After a brief vehicle pursuit and foot chase, Officer 1 engaged subject in a gunfight. Ofc 2 could not fire. Officer 3 fired 2 rounds. Officer 1 fired 21 rounds. Subject 901H. Officer 1  901H. Officer 2 survived a GSW to abdomen. Officer 3 was not injured. Officr 2 could not fire because  Officer 1 was in his line of fire. Officers were wearing police badges  ",Phoenix,
3/15/2014,1,N,N,B,M,33,Traffic Stop,1,1,H,M,Phoenix Police Department,Subject ran from ofcr. Ofcr gave chase. Subject turned on the ofcr. Ofcr fired one round missing the subject who was then taken into custody.,Phoenix,
3/13/2014,1,F,N,L,M,26,Domestic violence,1,1,W,M,Phoenix Police Department,Officers respond to a domestic violence call where the adult son is acting irrational and on heroin/family reported to suffer from mental issues. Subject does not respond to police commands and struggles with officers as they attempt to handcuff him. Lengthy fight ensues and subj reaches for ofcrs gun. ECD attempted multiple times without success.  Ofcrs injured and exhausted after long fight.  Subj is shot ending the threat. ,Phoenix,Bodily Force
3/18/2014,1,F,N,W,M,27,Stolen car,1,1,W,M,Phoenix Police Department,"SP in stolen vehicle pointed gun at Det. Pursuit ensued thru city into downtown. SP ""carjacked"" another vehicle, then exited garage. Rammed by 3 P.D. vehicles before coming to stop. Furtive movements and knowledge of SP gun led to OIS. Later determined to be a BB gun. SP's passenger indicated SP was using meth/heroin during vehicle pursuit",Phoenix,BB Gun
3/21/2014,1,N,N,B,M,34,Shoplifting,1,1,W,M,Phoenix Police Department,Ofc's respond to shoplifting. Suspect runs w/out merchandise. Ofc follows in veh. SP get into veh. Ofc contact breaks window ofc arm stuck as SP backs up. Ofc get free and discharged weapon as SP drove in his direction.,Phoenix,Vehicle
3/23/2014,1,F,N,B,M,26,Citizen Contact,2,1,W,M,Phoenix Police Department,"SP-1 physically attacked officer while officer was in his patrol vehicle, reached for officer's handgun x3 times. Officer fired duty weapon 2 times and struck SP-1. Drugs Related",Phoenix,Reached for Officer's Gun
4/11/2014,1,F,N,L,M,32,Ran from officers,6,1,W,M,Phoenix Police Department,"Subj contacted in apt complex, ran from ofcs. Ofc pursued on foot, physical struggle, subj obtained ofcs taser and tased him. Subj threatened to tase Ofc again, Ofc shot at subj 6 times, striking him 5 times. Deceased at scene.",Phoenix,Other - Taser
5/3/2014,1,N,N,L,M,24,Trespassing,1,1,W,M,Phoenix Police Department,"Ofc's responded to trespassing. Contact SP and get into foot pursuit.  Based on info provided by complainants Ofc thought SP had a gun. SP suddenly stops, bends over, stands up with raised arm. Ofc discharged weapon - believed SP was going to shoot partner. SP threw rocks. Per family, sp suffers from mental illness",Phoenix,Other - Rocks
5/27/2014,1,N,N,U,M,27,Suicide,1,1,H,M,Phoenix Police Department,"Ofcs responded to a medical office building regarding a subject who was acting violent and erratic, and had threatened suicide. Ofcrs arrived and attempted the taser several times without success. The subject ran at an ofcr holding a screwdriver and a syringe and the officer shot the subj one time, striking him in the chest. The subject survived and told investigators that he was trying to suicide by cop.",Phoenix,Knife/ Sword
7/28/2014,1,N,Y,L,F,31,Serving Arrest Warrant,8,2,H; W,M; M,Phoenix Police Department,"Officers attempted to arrest a subject with a felony warrant when she fled in a vehicle. After a tactical surveillance was initiated the subject was in an apartment complex parking lot and unable to escape in her vehicle. She then pointed a handgun at two officers who both shot at the subject. The subject was struck twice but survived.  She told investigators she wanted to suicide by cop, subj admitted to smoking meth",Phoenix,
8/3/2014,1,F,Y,U,M,24,Burglary,34,5,W; W; W; H; W,M; M; M; M; F,Phoenix Police Department,"Five ofcrs responded to a residential burglary and found the subject on a rooftop. The subject fired two rounds at the ofcrs, jumped off roof in the middle of the officer. Ofcrs fired back and killed the subject. No injury to ofcrs. Crossfire situation",Phoenix,
8/14/2014,1,F,N,B,F,51,Mental health,1,1,W,M,Phoenix Police Department,"Ofcrs responded to a mental health pickup order call for service at an apartment. The cal for service indicated the subject made threats to shoot the clinical team and is a danger to others. Ofcrs contacted the subj through a locked security screen door, but she refused to exit her apartment and shut the apartment door. Sergeant arrived and ordered the ofcrs to pick the locks on the security door. Ofcrs then began to open the apartment door, when the subject opened the door and swang a hammer at ofcrs. The sergeant fired one round, killing the subject. A misconduct investigation is underway for failure to supervise and DPS has criminal. ",Phoenix,Bat/Stick
8/23/2014,1,F,Y,L,M,40,Hit and run,12,3,W; W; W,M; M; M,Phoenix Police Department,"Subject fled from a hit and run collision. Victim followed and subject fired a handgun in the air in an effort to stop the victim from following him. Ofcrs later found the subject in his vehicle and he failed to stop. Canine units initiated a tactical surveillance and SAU joined. Subject drove into a Chevron and SAU initiated a tactical vehicle maneuver. The subject, who was outside, pulled his handgun out and aimed it at an SAU officer. Three officers shot, killing the subject. Departmental report indicated alcohol was a factor",Phoenix,
9/1/2014,1,F,Y,L,M,56,Noise complaint,7,2,W; A,M; M,Phoenix Police Department,"Ofcrs responded to an U trouble where complainant heard a loud noise. Ofcrs, while trying to find the cause of the noise, were shot at by a subject in his front yard, who possessed three long guns. Ofcrs took cover. The subject aimed toward the air unit and other ofcrs, so the listed ofcrs shot the subject from a rooftop across the street and ended the threat. The subject was killed. ",Phoenix,
9/18/2014,1,N,Y,L,M,23,Call for Service,1,1,H,M,Phoenix Police Department,"Officers responded to a 459R. Upon contact with the subject in the driveway, a fight ensued and the subject then pointed a .380 handgun at an officer, who had injured his shoulder in the fight. Ofcr retreated while pulling his handgun out. Subject fled and was again caught by the ofcr and a backup ofcr. Another fight ensued and the subject produced a knife. The original ofcr believed it to be the .380 handgun and shot the subj. The subject was struck in the groin and later booked after treatment. The .380 handgun was found in the subject's rear pocket.",Phoenix,
10/17/2014,1,N,N,W,M,29,Welfare check,3,1,W,M,Phoenix Police Department,"Ofc responded to a check welfare. Upon arrival, the Ofc observed the subj place a knife like object to the victim's neck. Ofc fired a round at subj, who then charged the ofc, who was retreating outside of the mobile home. Ofc fired 2 more times at subj. He was struck with one bullet, treated and booked. Knife was a galvanized pipe with tapered jagged edge. Subj, during criminal interview said he drank beer and uses meth. ",Phoenix,Knife/ Sword
12/2/2014,1,F,N,B,M,34,Drugs,2,1,W,M,Phoenix Police Department,"Ofcr received 2 citizen complaints regarding subject selling drugs out of his vehicle. Ofcr intended on watching subject/veh until more units arrived. However subject exits and begins to walk away. Ofc confronts and subj, who is carrying McDonald's food bags say ""Fuck you I'm not talking to you,"" as he reaches into his waistband area. Foot pursuit, then ofcr grabs subj from behind as they enter the aptmnt. Subj reaches into waistband area and ofcr believes subject is reaching for a gun. Ofc grabs subject's hand and feels the subj has something in his hand. Ofc can't keep subject from removing the item, so he pulls his gun and shoots the subj 2 times killing him.",Phoenix,
12/16/2014,1,F,Y,W,M,18,Welfare check,1,1,W,M,Phoenix Police Department,"Ofcrs responded to a check welfare call, where a suicidal/intoxicated subj was armed with a handgun. Subj was reported to have assaulted a 14 year old girl in the past and was making his way toward her house again.  Subj refused to comply with commands to drop the gun.  He walked in the residential street with the gun pointed to his head.  Ofcrs believed if he got inside the house, which contained a 12 and 14 year old girls, that he would hurt them so an ofcr fired one round from his rifle killing the subj. ",Phoenix,
12/18/2014,1,F,N,W,M,35,Assault,1,1,W,M,Phoenix Police Department,"Subj was throwing knives at several people, who thought they were rocks.  Ofcrs responded to criminal damage call.  Upon arrival the subj ran toward ofcrs vehicles and threw knives at them causing damage.  As ofcr got out of his vehicle, the subj raised his arm to throw another knife and the ofcr shot one round, striking the subj.  Subject later died. Per PACE the subj may suffer from mental issues. ",Phoenix,Knife/ Sword
1/25/2015,1,N,N,U,M,U,Stolen car,12,1,W,M,Phoenix Police Department,"Two officers riding in a marked Tahoe and using an automatic license plate reader found an occupied stolen truck on the roadway. Officers attemtped a Code 6, vehicle fled. Officers followed and the driver intentionally backed the truck into the officers' Tahoe on 3 separate occasions. On the third time, the officer in the passenger seat fired through the Tahoe windshield at the driver. The driver crashed into a tree and the stolen vehicle  caught fire. Officers could not immediately exit the Tahoe because of the damage sustained to the patrol Tahoe. Subject fled on foot and was not apprehended or identified.",Phoenix,Vehicle
1/27/2015,1,F,N,U,M,27,Robbery,5,2,W; W,M; M,Phoenix Police Department,"MOU officers and sergeants found a robbery subject in a motel room, used a ruse to get subject outside where he could be taken into custody. Subject was able to get to his vehicle and rammed a U/C police vehicle that was used to box the subject vehicle in. Upon 3rd or 4th time ramming, the MOU Sgt and an MOU Ofcr who were outside the driver's door on the the subject's vehicle, fired at the subject to end the threat. ",Phoenix,Vehicle
3/7/2015,1,F,N,W,M,29,Call for Service,1,1,W,M,Phoenix Police Department,"Officers respond to 927 U Trouble call for service. Subject contacted does not comply, brandishes a handgun style pellet gun. Waves at officers directino. Officer discharges one round from AR15. Y hit.",Phoenix,BB Gun
3/11/2015,1,N,N,L,M,34,Call for Service,2,1,W,M,Phoenix Police Department,Officer contacted subject and was stabbed in shoulder area through vest. Officer fired 2 rounds striking subject. Subject expected to recover.,Phoenix,Knife/ Sword
3/26/2015,1,N,Y,B,M,30,Burglary,6,3,W; W; W,M; M; M,Phoenix Police Department,"Officers observed a burglary suspect commit a burglary during surveillance. Subject drove to an apt complex and fled. Canine search was negative. Subject later emerged from an apt with an AK-47 and shot at officers, one bullet (shrapnel) hit an officer. Three officers fired at the subject at different times, only striking him once. He was later booked after a hospital stay.",Phoenix,
4/5/2015,1,F,N,W,M,51,Suicide,11,2,W; W,M; M,Phoenix Police Department,"Ofcrs responded to a call of a suicidal subject who was stabbing himself while walking down a street. Upon the ofcrs arrival, ofcrs issued commands to drop the knives. The subject refused and raised both knives at the officers while lunging toward them. Fearing for their safety, both officers discharged their service weapons striking the subject, who was pronounced at the scene. ",Phoenix,Knife/ Sword
4/10/2015,1,N,Y,B,M,35,Suicide,1,1,W,M,Phoenix Police Department,"Subject trheatening suicide over 21 with ex-girlfriend. Subject barricade, attempt negotiations. Subject not taking medication for mental illness per mom. Subject later exits house with a handgun. SAU deploys less lethal Arwen (sage) 3 times and hits subject, who still advances toward officers with handgun. SAU sniper shot subject 1 time and subject expected to recover. Also canine was deployed to drag subject away from gun on the ground.",Phoenix,
4/18/2015,1,F,Y,L,M,44,Mental health; Fiream,14,1,W,M,Phoenix Police Department,"On 4/18/15 at 1551 hours subject made a false report of snipers in a park. Upon investigation it was discovered that the subject had a mental health pick-up order. The subject barricaded himself in his vehicle. An extraction plan was made and during the extraction the subject pulled a handgun and fired 3 rounds at officers, striking one officer one time. Officers returned fire killing the subject in his vehicle. OIS officer was not the officer who sustained the gunshot wound. ",Phoenix,
5/18/2015,1,N,N,L,M,28,Call for Service,1,1,H,M,Phoenix Police Department,"901X Emergency CFS. Subject exits house and approaches officers with a knife. Officer fires one round. Non-Y shot.Taser deployed simultaneously as officer shot his firearm. Subject shot and fell to ground, but did not release knives. He was tased a second time and complied with officers commands to drop the knife. ",Phoenix,Knife/ Sword
7/9/2015,1,F,Y,W,M,69,Traffic Stop,9,2,W; W,M; M,Phoenix Police Department,"647 vehicle with stolen license plate. Attempted Code 6, subjects fled. While subject fled 245 PO times three (with vehicle). Subject tracked to apt complex. Subject brandished handgun at officer 2. Off 2 had a level 3 retention, could not draw firearm. Subject fled on foot; officer 1 dicharged one round, grazing subject's head. Officers give chase into apt complex. Subj pointed handgun again at officer 2. Officer 2 discharged eight rounds from firearm. Eight strikes, Y wounds.",Phoenix,
7/18/2015,1,F,Y,W,M,46,Burglary,6,1,W,M,Phoenix Police Department,"Initial call for service was a 459A audible alarm which was triggered by the victim as a signal for help. Upon PPD arrival, officers discovered a 415F. The subject had fled. During the ensuing K9 search, officers discovered a utility closet that the K9 alerted on. The K9 officer entered to check welfare of the person inside. He was confronted in the doorway of the closet by the subject who pointed a firearm at the K9 officer. The K9 officer discharged 6 rounds; Y injuries.Before OIS officer entered the closet, he deployed the canine in an effort to effect an arrest, however, subject was able to maintain his firearm.",Phoenix,
7/25/2015,1,N,Y,L,M,31,Domestic violence,5,1,H,M,Phoenix Police Department,"On 7/25/15 Officers responded to 415F call. Limited info given/gathered. Ofc attempted to get rear containment on target house when subject pointed a handgun in officer's direction. Ofc fired 5 rounds, two hits, 3 misses. Non Y injuries.",Phoenix,
8/25/2015,1,F,Y,W,M,41,Investigation,2,1,W,M,Phoenix Police Department,"Officers conducting follow-up/attempting to apprehend a subject. Subject goes into residence. Officers take up a position in alley and begin communication with subject. Subject would not keep hands visible. Subject raised hands, OIS officer sees a handgun through 1.5X (power scope). OIS officer fires two rounds; Y injuries.Subject had a North American Arms handgun .22 cal",Phoenix,
11/13/2015,1,N,Y,L,M,33,Suspicious person,25,2,W; W,M; M,Phoenix Police Department,Officers responding to a suspicious person call for service. Immediately upon making contact subject opens fire at officers. Rounds exchanged between subject and officers. Subject runs out of ammo and flees parking structure. Officers give chase subject taken into custody with no further incident. No injuries to officers. No injuries to subject.,Phoenix,
11/23/2015,1,N,Y,W,M,30,Stolen car,17,2,W; W,M; M,Phoenix Police Department,"Sgt was working off-duty in his personal vehicle and observed the subject try to open vehicles in a private business parking lot. Upon contact the subject fled on foot. Sgt followed in his vehicle to OIS location. Subject was hiding in a stairwell. As Sgt entered the parking lot and additional officer arrived, subject came out of hiding and fired 6 rounds at the Sgt and Officer. Both returned fire and the subject was struck 2 times. He survived and told investigators he was trying to commit suicide by cop.",Phoenix,Off-duty
12/20/2015,1,N,Y,L,M,28,Shooting,1,1,W,M,Phoenix Police Department,"Officers respond to shots fired call. Subject found on south end of apartment complex. When confronted, subject pointed a silver handgun at OIS officer. He discharged one round, missing the subject. Subject taken into custody with no further issue. ",Phoenix,
12/26/2015,1,F,N,W,M,41,Assaulting officer,1,1,H,M,Phoenix Police Department,"Subject threw an object at patrol sergeant vehicle.Requests more units respond for 647 individual. Subject takes cinder block pieces to PD precinct and breaks front door. OIS officer exits precinct to assist. Sgt and OIS officer make contact with subject. Subject throws a 1.4 pound river rock at officer. Officer discharges one round, striking subject. Subject later dies from injuries. Officer was struck by the rock the subject threw.",Phoenix,Other - Rocks
1/19/2016,1,F,Y,W,M,39,Shooting; domestic violence,9,3,W; W; W,M; M; M,Phoenix Police Department,"Subject intoxicated and arguing with sister fires one round near her. Sister calls 911 subject wants to 901X by PD. Officers arrive and set up containment. 6 hours of contact and negotiations. Subject exits house with a handgun, sits in chair in driveway. Subject puts handgun to his head then points in direction of officers. 3 SAU operatives fire service rifles; Y hits.",Phoenix,
